<?xml version="1.0" encoding="UTF-8"?>


<xs:schema xmlns:xs="http://www.w3.org/2001/XMLSchema">
    <xs:element name="suppliers">
        <xs:complexType>
            <xs:sequence>
                <xs:element name="supplier" maxOccurs="unbounded">
                    <xs:complexType>
                        <xs:sequence>
                            <xs:element name="supId" type="xs:int"></xs:element>
                            <xs:element name="supName" type="xs:string"></xs:element>
                            <xs:element name="products" maxOccurs="unbounded">
                                <xs:complexType>
                                    <xs:sequence>
                                        <xs:element name="product" maxOccurs="unbounded">
                                            <xs:complexType>
                                                <xs:sequence>
                                                    <xs:element name="pName" type="xs:string"></xs:element>
                                                </xs:sequence>
                                            </xs:complexType>
                                        </xs:element>
                                    </xs:sequence>
                                </xs:complexType>
                            </xs:element>
                        </xs:sequence>
                    </xs:complexType>
                </xs:element>
            </xs:sequence>
        </xs:complexType>
    </xs:element>
</xs:schema>